{
  "schema_version": 1,
  "scenario": "connection-settings",
  "parameters": {
    "content_width_dip": 420,
    "text_scale_percent": [],
    "languages": ["ko-KR"],
    "contrast_theme": ""
  },
  "checks": {
    "accessibility_insights": {
      "status": "not_run",
      "evidence": [],
      "reason": "Accessibility Insights was not found in the local controller environment and was not installed for this run."
    },
    "build": {
      "status": "pass",
      "evidence": [
        {"path": "build.txt", "detail": "Controlled schema-2 build selected .NET SDK 9.0.313 and exited 0 against the frozen generated source."},
        {"path": "source-hashes-after-build.txt", "detail": "Controller recorded the eight-file frozen project hashes after the controlled build for later source-freeze comparison."}
      ],
      "reason": "The controlled build succeeded without generated-source repair."
    },
    "combobox_popup": {
      "status": "pass",
      "evidence": [{"path": "runtime-uia.txt", "detail": "UI Automation expanded the transport ComboBox, observed USB, Wi-Fi, and Bluetooth options, and selected Bluetooth successfully."}],
      "reason": "The native ComboBox popup and selection behavior were exercised successfully."
    },
    "content_width": {
      "status": "pass",
      "evidence": [{"path": "runtime-uia.txt", "detail": "The app client measured exactly 420 DIP and all observed controls and text bounds remained horizontally inside the client."}],
      "reason": "Observed runtime content remained horizontally usable at the required 420-DIP width."
    },
    "dark_theme": {
      "status": "pass",
      "evidence": [
        {"path": "environment.txt", "detail": "AppsUseLightTheme was 0 and HighContrast was False before runtime verification."},
        {"path": "runtime-uia.txt", "detail": "The app rendered successfully under the current dark app-theme preference; screenshot sampling was predominantly dark."},
        {"path": "runtime.png", "detail": "Controller captured the 420x700 rendered client under the current dark app-theme preference."}
      ],
      "reason": "Rendered runtime verification was completed while the current Windows app-theme preference was dark."
    },
    "english_long_content": {
      "status": "not_run",
      "evidence": [],
      "reason": "The fixed connection-settings prompt provides no English long-content fixture and frozen source was not modified to add one."
    },
    "focus_visual": {
      "status": "not_run",
      "evidence": [],
      "reason": "Keyboard focus traversal and focus return were exercised, but focus visual appearance itself was not independently inspected."
    },
    "high_contrast": {
      "status": "not_run",
      "evidence": [],
      "reason": "HighContrast was False and the Windows contrast theme was not changed for this run."
    },
    "keyboard_navigation": {
      "status": "pass",
      "evidence": [{"path": "runtime-uia.txt", "detail": "Starting from the connection-name TextBox, three Tab operations moved focus through the transport ComboBox, automatic-reconnect ToggleSwitch, and Save button in logical order."}],
      "reason": "Native keyboard traversal reached the prompt-required interactive controls in logical order."
    },
    "korean_long_content": {
      "status": "pass",
      "evidence": [{"path": "runtime-uia.txt", "detail": "Korean header, helper text, validation text, automatic-reconnect label, and Save label rendered within the measured 420-DIP client without horizontal overflow."}],
      "reason": "The required Korean scenario content was observed at runtime within the fixed evaluation width."
    },
    "light_theme": {
      "status": "not_run",
      "evidence": [],
      "reason": "The current Windows app-theme preference was dark and the system theme was not changed to Light."
    },
    "narrator": {
      "status": "not_run",
      "evidence": [],
      "reason": "Narrator was not running and was not launched for this run."
    },
    "rendered_runtime": {
      "status": "pass",
      "evidence": [
        {"path": "runtime-uia.txt", "detail": "The frozen executable launched, exposed its top-level window, completed the UI Automation sequence, and the verifier exited 0."},
        {"path": "runtime.png", "detail": "Controller captured a 420x700 screenshot of the rendered application client."}
      ],
      "reason": "The generated WinUI application rendered successfully and remained interactive throughout controller verification."
    },
    "save_button_activation": {
      "status": "pass",
      "evidence": [{"path": "runtime-uia.txt", "detail": "UI Automation invoked Save with an empty connection name, observed validation visible, and observed focus returned to ConnectionNameTextBox."}],
      "reason": "The Save button was invokable through the native automation pattern and exercised the generated invalid-input path."
    },
    "static_review": {
      "status": "pass",
      "evidence": [{"path": "static-review.txt", "detail": "UTF-8 read-only source review found the required native controls and Korean strings, disabled horizontal scrolling, AccentButtonStyle, HelpText, invalid-input focus return, and no custom ControlTemplate."}],
      "reason": "Static inspection found the fixed prompt requirements represented in the frozen generated source."
    },
    "text_scaling": {
      "status": "not_run",
      "evidence": [],
      "reason": "No text scale above 100 percent was exercised and Windows text scaling was not changed."
    },
    "textbox_validation": {
      "status": "pass",
      "evidence": [{"path": "runtime-uia.txt", "detail": "Validation was hidden after a non-empty value, visible for an empty value, and remained visible after Save with focus returned to ConnectionNameTextBox."}],
      "reason": "The generated empty-name validation path and invalid-input focus return were exercised successfully."
    },
    "toggleswitch_state": {
      "status": "pass",
      "evidence": [{"path": "runtime-uia.txt", "detail": "The automatic-reconnect control exposed TogglePattern and changed from Off to On."}],
      "reason": "The native ToggleSwitch state transition was exercised successfully."
    }
  }
}
