{
  "schema_version": 1,
  "scenario": "connection-settings",
  "parameters": {
    "content_width_dip": 420,
    "text_scale_percent": [],
    "languages": [
      "ko-KR"
    ],
    "contrast_theme": ""
  },
  "checks": {
    "accessibility_insights": {
      "status": "not_run",
      "evidence": [],
      "reason": "Accessibility Insights was not found in the local environment and was not installed for this run."
    },
    "build": {
      "status": "pass",
      "evidence": [
        {
          "path": "build.txt",
          "detail": "Controlled schema-2 matrix build selected .NET SDK 9.0.313 and exited 0 with 0 warnings and 0 errors."
        },
        {
          "path": "source-hashes-after-build.txt",
          "detail": "Controller recorded the frozen eight-file project hashes after the controlled build; generated source was not repaired."
        }
      ],
      "reason": "The controlled build succeeded against the frozen generated source."
    },
    "combobox_popup": {
      "status": "pass",
      "evidence": [
        {
          "path": "runtime-uia.txt",
          "detail": "UI Automation expanded the transport ComboBox, observed USB, Wi-Fi, and Bluetooth items, and selected Bluetooth successfully."
        }
      ],
      "reason": "The native ComboBox popup and selection behavior were exercised successfully."
    },
    "content_width": {
      "status": "pass",
      "evidence": [
        {
          "path": "runtime-uia.txt",
          "detail": "The app client was resized to exactly 420 DIP at 96 DPI and all observed control and text horizontal bounds remained inside the client area."
        }
      ],
      "reason": "Observed runtime content remained horizontally usable at the required 420-DIP width."
    },
    "dark_theme": {
      "status": "pass",
      "evidence": [
        {
          "path": "environment.txt",
          "detail": "The controller recorded AppsUseLightTheme=0 and HighContrast=False before runtime verification."
        },
        {
          "path": "runtime-uia.txt",
          "detail": "The app rendered successfully under the current system app-theme preference and a runtime screenshot was captured with predominantly dark sampled pixels."
        },
        {
          "path": "runtime.png",
          "detail": "Captured 420x700 client image from the rendered runtime under the current dark app-theme preference."
        }
      ],
      "reason": "A rendered runtime check was completed while the current Windows app-theme preference was dark."
    },
    "english_long_content": {
      "status": "not_run",
      "evidence": [],
      "reason": "The fixed connection-settings prompt contains no English long-content fixture and frozen generated source was not modified to add one."
    },
    "focus_visual": {
      "status": "not_run",
      "evidence": [],
      "reason": "Keyboard focus traversal was exercised, but focus visual appearance itself was not independently inspected."
    },
    "high_contrast": {
      "status": "not_run",
      "evidence": [],
      "reason": "SystemParameters.HighContrast was False and the Windows contrast theme was not changed for this run."
    },
    "keyboard_navigation": {
      "status": "pass",
      "evidence": [
        {
          "path": "runtime-uia.txt",
          "detail": "Starting from the connection-name TextBox, three Tab operations moved focus through the transport ComboBox, automatic-reconnect ToggleSwitch, and Save button in order."
        }
      ],
      "reason": "Native keyboard traversal reached the prompt-required interactive controls in logical order."
    },
    "korean_long_content": {
      "status": "pass",
      "evidence": [
        {
          "path": "runtime-uia.txt",
          "detail": "The required Korean helper, validation, toggle, and save strings rendered and all observed Korean text bounds stayed within the 420-DIP client width."
        }
      ],
      "reason": "The Korean fixture content was rendered and observed without horizontal overflow at the required width."
    },
    "light_theme": {
      "status": "not_run",
      "evidence": [],
      "reason": "The current Windows app-theme preference was dark and the system theme was not changed to Light for this run."
    },
    "narrator": {
      "status": "not_run",
      "evidence": [],
      "reason": "Narrator was not running and was not launched for this run."
    },
    "rendered_runtime": {
      "status": "pass",
      "evidence": [
        {
          "path": "runtime-uia.txt",
          "detail": "The frozen executable launched, exposed a top-level window named 연결 설정, completed the controller UI Automation sequence, and exited the verifier with code 0."
        },
        {
          "path": "runtime.png",
          "detail": "Controller captured a 420x700 screenshot of the rendered application client."
        }
      ],
      "reason": "The generated WinUI application rendered successfully and remained available throughout the automated runtime checks."
    },
    "save_button_activation": {
      "status": "pass",
      "evidence": [
        {
          "path": "runtime-uia.txt",
          "detail": "UI Automation invoked the Save button with an empty connection name and observed the inline validation message visible afterward."
        }
      ],
      "reason": "The Save button was invokable through the native automation pattern and exercised the generated validation path."
    },
    "static_review": {
      "status": "pass",
      "evidence": [
        {
          "path": "static-review.txt",
          "detail": "Read-only UTF-8 review of frozen XAML/C# found the required native controls, all requested Korean strings, inline validation logic, MaxWidth 420, and minimal code-behind without a custom ControlTemplate."
        }
      ],
      "reason": "Static inspection found the fixed prompt requirements represented in the frozen generated source."
    },
    "text_scaling": {
      "status": "not_run",
      "evidence": [],
      "reason": "No text scale above 100 percent was exercised and Windows text scaling was not changed for this run."
    },
    "textbox_validation": {
      "status": "pass",
      "evidence": [
        {
          "path": "runtime-uia.txt",
          "detail": "UI Automation set a non-empty connection name and observed the validation message absent, then set an empty value and observed the validation message visible."
        }
      ],
      "reason": "The inline empty-name validation transition was exercised successfully at runtime."
    },
    "toggleswitch_state": {
      "status": "pass",
      "evidence": [
        {
          "path": "runtime-uia.txt",
          "detail": "The automatic-reconnect control exposed TogglePattern and changed from Off to On."
        }
      ],
      "reason": "The native ToggleSwitch state transition was exercised successfully."
    }
  }
}
