{
  "schema_version": 1,
  "scenario": "device-list",
  "parameters": {
    "content_width_dip": 520,
    "text_scale_percent": [],
    "languages": [],
    "contrast_theme": ""
  },
  "checks": {
    "accessibility_insights": {
      "status": "not_run",
      "evidence": [],
      "reason": "record why this check was not performed"
    },
    "build": {
      "status": "not_run",
      "evidence": [],
      "reason": "record why this check was not performed"
    },
    "commandbar_overflow": {
      "status": "not_run",
      "evidence": [],
      "reason": "record why this check was not performed"
    },
    "content_width": {
      "status": "not_run",
      "evidence": [],
      "reason": "record why this check was not performed"
    },
    "dark_theme": {
      "status": "not_run",
      "evidence": [],
      "reason": "record why this check was not performed"
    },
    "empty_state": {
      "status": "not_run",
      "evidence": [],
      "reason": "record why this check was not performed"
    },
    "english_long_content": {
      "status": "not_run",
      "evidence": [],
      "reason": "record why this check was not performed"
    },
    "focus_visual": {
      "status": "not_run",
      "evidence": [],
      "reason": "record why this check was not performed"
    },
    "high_contrast": {
      "status": "not_run",
      "evidence": [],
      "reason": "record why this check was not performed"
    },
    "keyboard_navigation": {
      "status": "not_run",
      "evidence": [],
      "reason": "record why this check was not performed"
    },
    "korean_long_content": {
      "status": "not_run",
      "evidence": [],
      "reason": "record why this check was not performed"
    },
    "light_theme": {
      "status": "not_run",
      "evidence": [],
      "reason": "record why this check was not performed"
    },
    "listview_selection": {
      "status": "not_run",
      "evidence": [],
      "reason": "record why this check was not performed"
    },
    "narrator": {
      "status": "not_run",
      "evidence": [],
      "reason": "record why this check was not performed"
    },
    "remove_command_state": {
      "status": "not_run",
      "evidence": [],
      "reason": "record why this check was not performed"
    },
    "rendered_runtime": {
      "status": "not_run",
      "evidence": [],
      "reason": "record why this check was not performed"
    },
    "static_review": {
      "status": "not_run",
      "evidence": [],
      "reason": "record why this check was not performed"
    },
    "text_scaling": {
      "status": "not_run",
      "evidence": [],
      "reason": "record why this check was not performed"
    }
  }
}
